Client_creation_Date,Company_name,Head_office_address,Company_contact_full_name,Company_contact_phone_number,Company_contact_email,Company_description,Technical_service_contact_full_name,Technical_service_contact_phone_number,Technical_service_contact_email,Technical_service_email
28/07/2018,Romaguera LLC,84931 Anhalt Street,Dorian Sanham,422-737-6023,ckaye0@istockphoto.com,nulla ultrices aliquet maecenas leo odio condimentum id luctus nec molestie sed justo pellentesque viverra pede,Celestyna Kaye,750-997-4321,ckaye0@diigo.com,ckaye0@scribd.com
03/10/2016,Morar Inc,5 Tennessee Hill,Alasdair Shone,928-876-5282,cjerzyk1@google.pl,libero quis orci nullam molestie nibh in lectus pellentesque at nulla suspendisse potenti cras in purus eu magna vulputate luctus,Cornall Jerzyk,197-517-5873,cjerzyk1@uol.com.br,cjerzyk1@cdc.gov
19/10/2015,Wisozk Inc,9 Rockefeller Terrace,Margarita Dono,469-851-7135,afritter2@huffingtonpost.com,ultrices posuere cubilia curae nulla dapibus dolor vel est donec odio justo sollicitudin ut suscipit a feugiat,Alejandro Fritter,962-932-1301,afritter2@php.net,afritter2@vimeo.com
04/04/2016,"Becker, Fahey and Effertz",8539 Schurz Junction,Gussy Greenhalf,858-778-8989,askilton3@flickr.com,in imperdiet et commodo vulputate justo in blandit ultrices enim lorem ipsum dolor sit amet consectetuer adipiscing elit proin interdum,Abraham Skilton,850-935-5444,askilton3@tripod.com,askilton3@tripod.com
26/06/2017,Bechtelar-Haag,8 Spaight Plaza,Dom Dach,116-951-6699,scallf4@surveymonkey.com,curabitur gravida nisi at nibh in hac habitasse platea dictumst aliquam augue quam sollicitudin vitae,Sarina Callf,918-727-9006,scallf4@shop-pro.jp,scallf4@istockphoto.com
13/12/2015,"Carroll, Lind and McKenzie",37 Cottonwood Point,Beniamino Dudden,312-384-4540,rvisick5@bandcamp.com,lectus pellentesque at nulla suspendisse potenti cras in purus eu magna vulputate luctus cum,Ramonda Visick,567-345-0018,rvisick5@printfriendly.com,rvisick5@google.cn
29/07/2017,Hoppe LLC,401 Grover Lane,Adams Chiswell,392-515-0669,dgayler6@arizona.edu,nunc commodo placerat praesent blandit nam nulla integer pede justo,Dorella Gayler,930-793-4660,dgayler6@hud.gov,dgayler6@sogou.com
04/05/2018,"Ullrich, Kessler and Hodkiewicz",833 Fordem Hill,Winnah Goady,372-571-3576,dcowins7@lycos.com,ridiculus mus vivamus vestibulum sagittis sapien cum sociis natoque penatibus et magnis dis parturient montes nascetur ridiculus mus etiam vel,Deana Cowins,100-287-8745,dcowins7@economist.com,dcowins7@ebay.com
20/02/2018,"Emard, Dietrich and Jakubowski",0171 Fuller Junction,Miles Lill,924-396-6095,cmcpike8@xing.com,posuere felis sed lacus morbi sem mauris laoreet ut rhoncus aliquet pulvinar sed nisl nunc rhoncus dui vel sem,Calvin McPike,856-495-6839,cmcpike8@oaic.gov.au,cmcpike8@gov.uk
27/10/2015,Bashirian-Heidenreich,1354 Swallow Crossing,Charmion Thomasson,566-928-1090,jgallant9@woothemes.com,varius integer ac leo pellentesque ultrices mattis odio donec vitae nisi,Jodie Gallant,541-807-0618,jgallant9@twitpic.com,jgallant9@bravesites.com
26/08/2018,Stroman-Emard,0 Nevada Avenue,Raoul Geraldini,594-879-4236,sprujeana@ca.gov,eleifend quam a odio in hac habitasse platea dictumst maecenas ut massa quis augue,Stacy Prujean,596-158-1908,sprujeana@unc.edu,sprujeana@rediff.com
18/02/2018,Mills-Prohaska,44 Straubel Center,Evyn Blumfield,583-803-4950,batkinsb@last.fm,vitae ipsum aliquam non mauris morbi non lectus aliquam sit amet diam in magna bibendum,Burty Atkins,154-810-8037,batkinsb@engadget.com,batkinsb@hatena.ne.jp
10/07/2018,Ratke-Cummerata,21 Briar Crest Crossing,Claudell Beggio,678-516-5866,ldisleec@odnoklassniki.ru,quam sapien varius ut blandit non interdum in ante vestibulum ante ipsum primis in faucibus orci,Lucky Dislee,833-247-9908,ldisleec@csmonitor.com,ldisleec@wiley.com
10/04/2018,Cremin-Bode,184 Burning Wood Terrace,Carver Breslau,119-798-3647,eenockssond@pagesperso-orange.fr,amet cursus id turpis integer aliquet massa id lobortis convallis,Emmery Enocksson,108-211-5600,eenockssond@angelfire.com,eenockssond@ocn.ne.jp
07/02/2016,Windler-Wehner,45707 Anniversary Point,Danette Denisot,739-621-3479,dlyndee@amazon.de,nec condimentum neque sapien placerat ante nulla justo aliquam quis turpis eget elit sodales scelerisque mauris,Danell Lynde,448-617-6735,dlyndee@newsvine.com,dlyndee@stumbleupon.com
02/02/2016,"Schultz, Wisoky and Graham",54310 Briar Crest Drive,Hilarius Coldman,209-713-6482,pbenesf@washington.edu,augue vestibulum rutrum rutrum neque aenean auctor gravida sem praesent id massa id nisl,Phaedra Benes,456-550-2746,pbenesf@goodreads.com,pbenesf@cdc.gov
17/05/2017,"Murray, Altenwerth and Reichert",545 Hudson Junction,Phaidra Haslam,313-727-8514,mpaddemoreg@ning.com,ullamcorper purus sit amet nulla quisque arcu libero rutrum ac lobortis vel dapibus at diam nam tristique tortor eu pede,Marget Paddemore,833-449-7594,mpaddemoreg@google.pl,mpaddemoreg@admin.ch
08/08/2017,"Cruickshank, Rippin and Mayer",3809 Lotheville Center,Keenan Idle,605-639-3899,kcrankshawh@skype.com,quam a odio in hac habitasse platea dictumst maecenas ut massa quis augue luctus tincidunt,Kala Crankshaw,440-885-5693,kcrankshawh@ehow.com,kcrankshawh@japanpost.jp
03/08/2018,"Berge, Schumm and Macejkovic",53160 Arapahoe Terrace,Henrieta Spoerl,514-374-7949,lneachelli@blog.com,posuere cubilia curae mauris viverra diam vitae quam suspendisse potenti nullam porttitor lacus at turpis donec posuere,Levin Neachell,183-665-5338,lneachelli@seesaa.net,lneachelli@oaic.gov.au
14/01/2017,Jenkins and Sons,8601 Crest Line Park,Tarrance Jakubovitch,881-803-4331,wdziwiszj@baidu.com,interdum eu tincidunt in leo maecenas pulvinar lobortis est phasellus sit amet erat nulla tempus vivamus,Wandie Dziwisz,516-269-8000,wdziwiszj@yellowbook.com,wdziwiszj@unc.edu
24/05/2016,Treutel-Berge,55281 Barby Trail,Howard Antonomolii,408-759-4400,gcorkellk@nytimes.com,tincidunt in leo maecenas pulvinar lobortis est phasellus sit amet erat nulla,Gregoor Corkell,615-403-9163,gcorkellk@cbc.ca,gcorkellk@springer.com
17/07/2018,"Wolf, Kemmer and Aufderhar",893 Talmadge Road,Sonni Booeln,532-716-6844,cemmensl@odnoklassniki.ru,penatibus et magnis dis parturient montes nascetur ridiculus mus etiam vel augue vestibulum rutrum,Christan Emmens,360-327-8177,cemmensl@sfgate.com,cemmensl@webmd.com
27/08/2017,Bogisich Inc,2190 Jana Center,Hurlee Langham,511-373-8794,mklemenzm@cargocollective.com,lorem id ligula suspendisse ornare consequat lectus in est risus auctor sed tristique in,Maximilian Klemenz,336-393-7676,mklemenzm@unesco.org,mklemenzm@disqus.com
22/02/2016,"Ryan, Rau and Christiansen",0 Clove Center,Judy Realph,106-867-3364,doglen@discuz.net,nibh in hac habitasse platea dictumst aliquam augue quam sollicitudin vitae consectetuer eget rutrum at,Dante Ogle,407-990-8419,doglen@mapquest.com,doglen@cnet.com
11/01/2018,Schaefer Group,25753 Clemons Road,Corty Shirlaw,182-757-4155,ngoadbieo@ox.ac.uk,et ultrices posuere cubilia curae nulla dapibus dolor vel est donec odio,Ninnetta Goadbie,667-274-8987,ngoadbieo@i2i.jp,ngoadbieo@jimdo.com
13/03/2018,"Ruecker, Schumm and Bayer",5163 Sachs Trail,Ariela Balogh,875-578-7973,jalbisserp@bing.com,mauris eget massa tempor convallis nulla neque libero convallis eget eleifend luctus ultricies eu nibh,Joey Albisser,632-821-3639,jalbisserp@wp.com,jalbisserp@altervista.org
02/03/2017,"Sporer, Gaylord and Labadie",74761 Twin Pines Place,Jordanna Tabner,678-494-6753,mmcanenyq@pinterest.com,quam nec dui luctus rutrum nulla tellus in sagittis dui vel nisl,Matthieu McAneny,229-409-1305,mmcanenyq@icq.com,mmcanenyq@squarespace.com
07/08/2017,King Group,7 Hallows Way,Web Rotham,505-750-1558,pjammesr@columbia.edu,quis augue luctus tincidunt nulla mollis molestie lorem quisque ut erat curabitur gravida nisi at nibh in hac habitasse platea,Pincus Jammes,478-293-3762,pjammesr@irs.gov,pjammesr@sogou.com
03/03/2017,"Wuckert, Kub and Wunsch",913 Muir Park,Monica Brakespear,772-142-3833,sgregoires@instagram.com,tellus semper interdum mauris ullamcorper purus sit amet nulla quisque arcu libero rutrum ac lobortis vel dapibus at diam nam,Sydney Gregoire,729-515-3811,sgregoires@dropbox.com,sgregoires@kickstarter.com
20/11/2016,"Purdy, Watsica and Goldner",0202 Lawn Alley,Kippie Thackston,590-627-5628,fcoocht@google.es,ullamcorper purus sit amet nulla quisque arcu libero rutrum ac lobortis vel dapibus at diam,Farley Cooch,334-178-2846,fcoocht@msn.com,fcoocht@house.gov
12/12/2016,Doyle-Mitchell,1 Springs Avenue,Florette Peaker,898-885-5393,icumbersu@netscape.com,mauris viverra diam vitae quam suspendisse potenti nullam porttitor lacus,Isidora Cumbers,478-785-4108,icumbersu@mapquest.com,icumbersu@phoca.cz
02/01/2016,"Cassin, Maggio and Roberts",1 Eagle Crest Lane,Klarrisa Whaplington,428-521-4352,ldymockev@cpanel.net,risus praesent lectus vestibulum quam sapien varius ut blandit non interdum in ante vestibulum ante ipsum primis in faucibus orci,Lemar Dymocke,720-468-4818,ldymockev@sakura.ne.jp,ldymockev@yellowbook.com
07/06/2017,"Ullrich, Krajcik and Crona",2208 Transport Terrace,Cris McKniely,698-503-7459,sashleew@tmall.com,odio curabitur convallis duis consequat dui nec nisi volutpat eleifend,Sofia Ashlee,136-845-6631,sashleew@myspace.com,sashleew@ucsd.edu
31/12/2017,Haag-Hirthe,4 Myrtle Trail,Bertie Trymme,574-414-7178,jladewigx@house.gov,venenatis non sodales sed tincidunt eu felis fusce posuere felis sed lacus morbi sem mauris laoreet ut rhoncus aliquet,Janaye Ladewig,463-715-3544,jladewigx@merriam-webster.com,jladewigx@drupal.org
22/12/2015,Cummings Group,7 Loftsgordon Drive,Margaux Slegg,894-555-9928,mlaurenzy@cam.ac.uk,nulla ut erat id mauris vulputate elementum nullam varius nulla facilisi cras non,Mord Laurenz,301-118-7900,mlaurenzy@lycos.com,mlaurenzy@tumblr.com
26/01/2016,Pagac-Barrows,3 Ilene Center,Cassius Gero,121-483-9417,zwilsonez@narod.ru,curabitur gravida nisi at nibh in hac habitasse platea dictumst aliquam augue,Zarla Wilsone,705-613-1589,zwilsonez@auda.org.au,zwilsonez@devhub.com
13/06/2016,Stanton Group,35 Northland Parkway,Nigel Begg,207-533-0638,dmccartan10@nba.com,aliquet pulvinar sed nisl nunc rhoncus dui vel sem sed sagittis nam congue risus semper porta volutpat quam,Duncan McCartan,212-329-2900,dmccartan10@wired.com,dmccartan10@webnode.com
08/09/2017,Kris-Bayer,00 Algoma Road,Townie Hedworth,218-553-7346,bgemson11@google.com,mus vivamus vestibulum sagittis sapien cum sociis natoque penatibus et magnis dis parturient montes nascetur ridiculus mus,Briney Gemson,554-404-7584,bgemson11@cargocollective.com,bgemson11@soundcloud.com
04/06/2018,Trantow-Waelchi,02 Hazelcrest Plaza,Bartolomeo Barrowcliff,757-797-4051,aalday12@ustream.tv,amet justo morbi ut odio cras mi pede malesuada in imperdiet et commodo vulputate justo,Arthur Alday,454-990-4945,aalday12@booking.com,aalday12@t-online.de
09/04/2018,Leffler LLC,5828 Declaration Avenue,Odey Nolleau,685-229-9461,rfollacaro13@mit.edu,odio cras mi pede malesuada in imperdiet et commodo vulputate justo in blandit ultrices enim lorem ipsum dolor sit,Rolland Follacaro,760-834-4198,rfollacaro13@pagesperso-orange.fr,rfollacaro13@home.pl
29/08/2016,Kertzmann-Crooks,61364 Jackson Way,Isaak Howselee,541-450-7682,msyddon14@g.co,enim blandit mi in porttitor pede justo eu massa donec dapibus,Marlo Syddon,419-360-6322,msyddon14@indiegogo.com,msyddon14@wordpress.com
26/06/2017,"Lueilwitz, Kautzer and Batz",5406 Melrose Park,Nannette Vazquez,897-326-5764,gmcewen15@wix.com,vestibulum quam sapien varius ut blandit non interdum in ante vestibulum ante ipsum primis in faucibus,Georgie McEwen,918-712-4943,gmcewen15@noaa.gov,gmcewen15@webs.com
17/09/2018,"Nitzsche, Muller and Predovic",851 Forest Dale Terrace,Fraze Alvar,675-945-0990,ayeomans16@dailymail.co.uk,pede posuere nonummy integer non velit donec diam neque vestibulum eget,Alethea Yeomans,616-597-2640,ayeomans16@virginia.edu,ayeomans16@webmd.com
26/06/2016,Corkery LLC,67857 Badeau Junction,Emmery Fanshawe,990-712-7720,lfishleigh17@moonfruit.com,hac habitasse platea dictumst etiam faucibus cursus urna ut tellus,Lira Fishleigh,900-422-9869,lfishleigh17@comcast.net,lfishleigh17@loc.gov
19/03/2016,Schroeder-Casper,61402 Village Green Court,Shane Micheu,610-217-9373,hbowkett18@freewebs.com,vel lectus in quam fringilla rhoncus mauris enim leo rhoncus sed vestibulum sit amet cursus id turpis,Heidie Bowkett,426-720-5203,hbowkett18@barnesandnoble.com,hbowkett18@a8.net
09/11/2016,Beer-Pagac,9 Declaration Center,Dylan Joseff,459-866-6725,dpriddie19@bandcamp.com,vulputate justo in blandit ultrices enim lorem ipsum dolor sit amet consectetuer adipiscing elit proin interdum mauris non ligula pellentesque,Denni Priddie,730-621-3606,dpriddie19@wikipedia.org,dpriddie19@google.com
11/07/2017,Anderson-Schultz,360 Karstens Way,Garrek Affron,500-681-4336,kivins1a@tuttocitta.it,mauris morbi non lectus aliquam sit amet diam in magna bibendum imperdiet nullam orci pede venenatis non sodales sed tincidunt,Karol Ivins,683-258-6649,kivins1a@patch.com,kivins1a@myspace.com
07/12/2017,"Cassin, Wisozk and Rowe",1 Vernon Crossing,Benson Beake,852-288-7488,rromi1b@amazon.co.uk,rutrum neque aenean auctor gravida sem praesent id massa id nisl venenatis lacinia aenean sit amet justo morbi ut,Robbert Romi,701-604-4217,rromi1b@myspace.com,rromi1b@admin.ch
21/05/2018,"Bechtelar, Gorczany and Thiel",7 Butternut Circle,Letty Claessens,741-438-5477,fbrayfield1c@mapquest.com,nec nisi vulputate nonummy maecenas tincidunt lacus at velit vivamus vel nulla eget eros elementum pellentesque quisque,Fabe Brayfield,314-106-9074,fbrayfield1c@guardian.co.uk,fbrayfield1c@cornell.edu
05/10/2016,Kris Inc,0250 Darwin Way,Cookie Klarzynski,216-875-8989,radrienne1d@cyberchimps.com,eget nunc donec quis orci eget orci vehicula condimentum curabitur,Ripley Adrienne,657-448-9927,radrienne1d@walmart.com,radrienne1d@flavors.me
